{
  "country": "Philippines",
  "country_code": "PH",
  "island_group": "Visayas",
  "region": "Western Visayas",
  "region_code": "06",
  "province": "Iloilo",
  "province_code": "0630",
  "city": "Iloilo City",
  "city_type": "highly_urbanized_city",
  "postal_code": "5000",
  "latitude": 10.7202,
  "longitude": 122.5621,
  "routes": [
    {
      "route_code": "01",
      "name": "01. Barrio Obrero – Lapuz to City Proper Loop",
      "waypoints": [
        {
          "sequence": 1,
          "sub_locality": "Lapuz",
          "sub_locality_type": "district",
          "street": "Everlasting Street",
          "destination": "Barrio Obrero",
          "latitude": 10.696163,
          "longitude": 122.5849111
        },
        {
          "sequence": 2,
          "sub_locality": "Lapuz",
          "sub_locality_type": "district",
          "street": "Rizal Street",
          "destination": "Iloilo, Guimaras Ferry Wharf (FF Cruz, RORO)",
          "latitude": 10.7031638,
          "longitude": 122.5714665
        },
        {
          "sequence": 3,
          "sub_locality": "Lapuz",
          "sub_locality_type": "district",
          "street": "Iznart Street",
          "destination": "Casa Real de Iloilo, Cabalum Western College, YMCA, Philippine Statistcis Authority, Citadines, Shopwise, Hua Siong College of Iloilo (Main)",
          "latitude": 10.7202,
          "longitude": 122.5621
        },
        {
          "sequence": 4,
          "sub_locality": "Lapuz",
          "sub_locality_type": "district",
          "street": "J.M. Basa Street",
          "destination": "Plazoleta Gay, Calle Real, Old Iloilo Business District",
          "latitude": 10.7202,
          "longitude": 122.5621
        },
        {
          "sequence": 5,
          "sub_locality": "Lapuz",
          "sub_locality_type": "district",
          "street": "Guanco Street",
          "destination": "Iloilo Central Market, Gaisano Capital Guanco",
          "latitude": 10.7202,
          "longitude": 122.5621
        },
        {
          "sequence": 6,
          "sub_locality": "Lapuz",
          "sub_locality_type": "district",
          "street": "Rizal Street",
          "destination": "University of Iloilo PHINMA, Goldberry Lite Hotel",
          "latitude": 10.7031638,
          "longitude": 122.5714665
        },
        {
          "sequence": 7,
          "sub_locality": "Lapuz",
          "sub_locality_type": "district",
          "street": "Ortiz Street",
          "destination": "Museum of Philippine Economic History",
          "latitude": 10.7202,
          "longitude": 122.5621
        },
        {
          "sequence": 8,
          "sub_locality": "Lapuz",
          "sub_locality_type": "district",
          "street": "J.M. Basa Street",
          "destination": "Sunburst Park, Social Security System",
          "latitude": 10.7202,
          "longitude": 122.5621
        },
        {
          "sequence": 9,
          "sub_locality": "Lapuz",
          "sub_locality_type": "district",
          "street": "Iznart Street",
          "destination": "Casa Real de Iloilo, Cabalum Western College, YMCA, Philippine Statistcis Authority, Citadines, Shopwise, Hua Siong College of Iloilo (Main)",
          "latitude": 10.7202,
          "longitude": 122.5621
        },
        {
          "sequence": 10,
          "sub_locality": "Lapuz",
          "sub_locality_type": "district",
          "street": "Rizal Street",
          "destination": "Iloilo, Guimaras Ferry Wharf (FF Cruz, RORO)",
          "latitude": 10.7031638,
          "longitude": 122.5714665
        },
        {
          "sequence": 11,
          "sub_locality": "Lapuz",
          "sub_locality_type": "district",
          "street": "Everlasting Street",
          "destination": "Barrio Obrero",
          "latitude": 10.696163,
          "longitude": 122.5849111
        }
      ]
    },
    {
      "route_code": "02",
      "name": "02. Villa Plaza to City Proper via Calumpang",
      "waypoints": [
        {
          "sequence": 1,
          "sub_locality": "Villa",
          "sub_locality_type": "district",
          "street": "Corner Yulo Street",
          "destination": "Break, Restaurant",
          "latitude": 10.7202,
          "longitude": 122.5621
        },
        {
          "sequence": 2,
          "sub_locality": "Villa",
          "sub_locality_type": "district",
          "street": "Baluarte-Calumpang-Villa-Oton Blvd",
          "destination": "Calaparan",
          "latitude": 10.7202,
          "longitude": 122.5621
        },
        {
          "sequence": 3,
          "sub_locality": "Molo",
          "sub_locality_type": "district",
          "street": "Baluarte-Calumpang-Villa-Oton Blvd",
          "destination": "Calumpang, Juntado Subdivision, Baluarte Elementary School, Green Dragon Lodge, Sofia Lodge",
          "latitude": 10.6923226,
          "longitude": 122.5520705
        },
        {
          "sequence": 4,
          "sub_locality": "Molo",
          "sub_locality_type": "district",
          "street": "Corner Infante Street",
          "destination": "Iloilo Fish Port Complex",
          "latitude": 10.7202,
          "longitude": 122.5621
        },
        {
          "sequence": 5,
          "sub_locality": "City Proper",
          "sub_locality_type": "district",
          "street": "Rizal Street",
          "destination": "Iloilo City Social Hygiene Clinic",
          "latitude": 10.6921875,
          "longitude": 122.5632014
        },
        {
          "sequence": 6,
          "sub_locality": "City Proper",
          "sub_locality_type": "district",
          "street": "Ledesma Street",
          "destination": "Tanza Church, Rizal Elementary School, Colegio de las Hijas de Jesus, Robinsons Place Iloilo, Go Hotels Iloilo1688 Mall, Plazoleta Gay, Socorro Drug",
          "latitude": 10.6954224,
          "longitude": 122.5657404
        },
        {
          "sequence": 7,
          "sub_locality": "City Proper",
          "sub_locality_type": "district",
          "street": "Iznart Street",
          "destination": "Filipino, Chinese Friendship Arch, Iloilo Central Market, Iloilo Gr, Hotel",
          "latitude": 10.6971013,
          "longitude": 122.5690152
        },
        {
          "sequence": 8,
          "sub_locality": "City Proper",
          "sub_locality_type": "district",
          "street": "Rizal Street",
          "destination": "University of Iloilo, PHINMA, Gaisano Capital Guanco, Goldberry Lite Hotel",
          "latitude": 10.6921875,
          "longitude": 122.5632014
        },
        {
          "sequence": 9,
          "sub_locality": "City Proper",
          "sub_locality_type": "district",
          "street": "Ortiz Street",
          "destination": "Museum of Philippine Economic History",
          "latitude": 10.6909869,
          "longitude": 122.5715786
        },
        {
          "sequence": 10,
          "sub_locality": "City Proper",
          "sub_locality_type": "district",
          "street": "J.M. Basa Street",
          "destination": "Iloilo City Hall, Plaza Libertad, San Jose Church",
          "latitude": 10.6940821,
          "longitude": 122.5709558
        },
        {
          "sequence": 11,
          "sub_locality": "City Proper",
          "sub_locality_type": "district",
          "street": "Rizal Street",
          "destination": "University of Iloilo, PHINMA, Gaisano Capital Guanco, Goldberry Lite Hotel",
          "latitude": 10.6921875,
          "longitude": 122.5632014
        },
        {
          "sequence": 12,
          "sub_locality": "City Proper",
          "sub_locality_type": "district",
          "street": "Iznart Street",
          "destination": "Filipino, Chinese Friendship Arch, Iloilo Central Market, Iloilo Gr, Hotel",
          "latitude": 10.6971013,
          "longitude": 122.5690152
        },
        {
          "sequence": 13,
          "sub_locality": "City Proper",
          "sub_locality_type": "district",
          "street": "Ledesma Street",
          "destination": "Tanza Church, Rizal Elementary School, Colegio de las Hijas de Jesus, Robinsons Place Iloilo, Go Hotels Iloilo1688 Mall, Plazoleta Gay, Socorro Drug",
          "latitude": 10.6954224,
          "longitude": 122.5657404
        },
        {
          "sequence": 14,
          "sub_locality": "City Proper",
          "sub_locality_type": "district",
          "street": "Rizal Street",
          "destination": "Iloilo City Social Hygiene Clinic",
          "latitude": 10.6921875,
          "longitude": 122.5632014
        },
        {
          "sequence": 15,
          "sub_locality": "City Proper",
          "sub_locality_type": "district",
          "street": "Infante Street",
          "destination": "Iloilo Fish Port Complex",
          "latitude": 10.6929094,
          "longitude": 122.555363
        },
        {
          "sequence": 16,
          "sub_locality": "Molo",
          "sub_locality_type": "district",
          "street": "Baluarte-Calumpang-Villa-Oton Blvd",
          "destination": "Calumpang, Juntado Subdivision, Baluarte Elementary School, Green Dragon Lodge, Sofia Lodge",
          "latitude": 10.6923226,
          "longitude": 122.5520705
        },
        {
          "sequence": 17,
          "sub_locality": "Villa",
          "sub_locality_type": "district",
          "street": "Baluarte-Calumpang-Villa-Oton Blvd",
          "destination": "Calaparan",
          "latitude": 10.7202,
          "longitude": 122.5621
        }
      ]
    },
    {
      "route_code": "03",
      "name": "03. Ungka to Iloilo City Proper via CPU",
      "waypoints": [
        {
          "sequence": 1,
          "sub_locality": "Jaro",
          "sub_locality_type": "district",
          "street": "ITGSI Terminal",
          "destination": "Iloilo Transport, General Services, Inc. (ITGSI)",
          "latitude": 10.7202,
          "longitude": 122.5621